Title,Authors,Contributors,ISBN/UID,Format,Read Status,Date Added,Last Date Read,Dates Read,Read Count,Moods,Pace,Character- or Plot-Driven?,Strong Character Development?,Loveable Characters?,Diverse Characters?,Flawed Characters?,Star Rating,Review,Content Warnings,Content Warning Description,Tags,Owned?
Our Town,Thornton Wilder,"Donald Margulies (Contributor), Tappan Wilder (Contributor)",9780060512637,paperback,read,2025/01/15,2025/01/20,2025/01/20,1,"",,,,,,,5.0,"Thorton Wilder opens <i>Our Town</i> with precise, almost clinical specificity:<br><blockquote>""<b>STAGE MANAGER:</b> This play is called “Our Town.” It was written by Thornton Wilder; produced and directed by A.&nbsp;.&nbsp;.&nbsp;. (or: produced by A.&nbsp;.&nbsp;.&nbsp;.&nbsp;; directed by B.&nbsp;.&nbsp;.&nbsp;.). In it you will see Miss C.&nbsp;.&nbsp;.&nbsp;.&nbsp;; Miss D.&nbsp;.&nbsp;.&nbsp;.&nbsp;; Miss E.&nbsp;.&nbsp;.&nbsp;.&nbsp;; and Mr. F.&nbsp;.&nbsp;.&nbsp;.&nbsp;; Mr. G.&nbsp;.&nbsp;.&nbsp;.&nbsp;; Mr. H.&nbsp;.&nbsp;.&nbsp;.&nbsp;; and many others. The name of the town is Grover’s Corners, New Hampshire—just across the Massachusetts line: latitude 42 degrees 40 minutes; longitude 70 degrees 37 minutes. The First Act shows a day in our town. The day is May 7, 1901. The time is just before dawn.""</blockquote><br><br>This opening pins the play to an exact time and place. Even when the play first premiered in 1938, 1901 was already long past. And yet, <i>Our Town</i> resonates deeply. Why?<br><br>In recent years, I’ve been obsessed with Noah Kahan’s album <i>Stick Season</i>, which captures the specificity of his experience growing up in small-town Vermont. The album’s title — <i>Stick Season</i> — refers to what Kahan describes as a uniquely New England phenomenon: the transitional period between the fall and winter.<br><br>Kahan often expresses his surprise and gratitude that the album resonates far beyond New England. He marvels at the fact that audiences from across the globe show up to sing, dance, and cry to his songs about small-town life: ""They can’t all be from Vermont or New Hampshire. They’re from all over the world and all over the country, and it’s an unbelievable feeling.""<br><br>This phenomenon, that the specific is often what resonates the most universally, is at the heart of Our Town. The truths embedded in Grover’s Corners belong to all of us. As Wilder shows, specificity doesn’t alienate. Specificity invites us in. Its universality isn’t born from grand gestures but from small truths: the rituals of family breakfasts, the awkwardness of first love, the unrelenting passage of time.<br><br>Like Kahan’s songs, Our Town roots itself in the deeply personal, making it all the more meaningful to audiences far removed from its setting.<br><br>Unlike Kahan, I don’t think Wilder was surprised by his play’s universal appeal. The title, Our Town, speaks for itself. It suggests ownership, connection, and shared humanity. Grover’s Corners becomes a microcosm of the human experience.<br><br>I decided I pick up <i>Our Town</i> after finishing Ann Patchett's Tom Lake. Given that Tom Lake had already ""spoiled"" the ending for me, I wasn't expecting this play to make me that emotional. I knew, or at least thought I knew, what was coming.<br><br>I was very very wrong. I watched some stolen version on YouTube of the TV movie for the 2003 Westport Country Playhouse production with Paul Newman as Stage Manager and I <i>sobbed</i> at the end. When reading a note from Wilder's nephew at the end of the script, I learned that this particular production came together, at least in part, as a response to 9/11: <br><br><blockquote>""Theaters increasingly turn to <i>Our Town</i> seeking a way to celebrate and depict hard-won lessons about the preciousness of life and community in the wake of trauma. Take, for example, Joanne Woodward’s decision to produce <i>Our Town</i>, starring Paul Newman, at Westport Country Playhouse in Connecticut, and later on Broadway, in response to the 9/11 attacks. And following the 2017 suicide bombing at Manchester Arena in the UK, the Manchester Royal Exchange Theatre mounted an enormously moving, successful production of <i>Our Town</i> dedicated to the memory of those who had died.""</blockquote><br><br>Emily’s final words resonate deeply: “Oh, earth, you're too wonderful for anybody to realize you. Do any human beings ever realize life while they live it—every, every minute?” The beauty of life lies in its smallest moments and that noticing them is what it means to be human.","",,"",No
A Wrinkle in Time,Madeleine L'Engle,"",9781250153272,paperback,read,2023/09/02,2025/08/04,2025/08/04,1,"",,,,,,,3.0,"I just finished re-reading A Wrinkle in Time, and the parallels to today’s climate, especially around AI, are haunting.<br><br>The story follows 13-year-old misfit Meg Murry, her brilliant younger brother Charles Wallace, and their new friend Calvin as they travel through space and time to rescue Meg and Charles’s father, who is imprisoned on the planet Camazotz.<br><br>If you've read A Wrinkle in Time, you might remember Camazotz, where every house is the same and children bounce balls in perfect synchrony, their movements dictated by an invisible force. It’s a chilling image. Everyone from the planet is placidly content as their every thought and action is controlled by IT, a disembodied brain that has taken over all decision-making. No one thinks for themselves. There is neither opportunity nor desire for individuality.<br><br><img src=""https://substackcdn.com/image/fetch/$s_!RUfU!,f_auto,q_auto:good,fl_progressive:steep/https%3A%2F%2Fsubstack-post-media.s3.amazonaws.com%2Fpublic%2Fimages%2F34de561b-87a6-4c0c-8f9d-f2c0a0951b6a_480x200.gif"" alt=""description""><br><br>Relinquishing control to IT has a powerful appeal. It promises peace and freedom, and in many ways, it delivers. Letting IT make all the decisions removes anxiety, eliminates difficult choices, and protects people from the pain and uncertainty that come with thinking for themselves.<br><br>Life on Camazotz is frictionless. No one struggles. No one fails. No one has to face the unknown.<br><br>But it's not freedom with a capital F. It's the absence of everything that makes us human—struggle, growth, love, purpose. The residents of Camazotz have abdicated humanity for comfort, and what they've gotten in return is a kind of living death.<br><br>When IT tries to convince Meg, Charles Wallace, and Calvin to surrender to its all-controlling power, the offer is seductive. Why suffer when you could be at peace? Why deal with the pain of being different? Why make hard decisions when someone infinitely smarter could make them for you?<br><br>It is the same temptation behind students submitting AI-written essays or job seekers using AI agents as interview surrogates. Wouldn't it be easier to let the machines handle the hard parts?<br><br>I wrote more about a wrinkle in time &amp; AI on my substack: <a href=""https://graceraper.substack.com/p/terrified-of-agi-pick-up-a-children"">Terrified of AI? Pick up a Children's Book</a>","",,"",No
Crown of Midnight,Sarah J. Maas,"",9781639730964,hardcover,read,2023/09/01,"","",1,"",,,,,,,,,"",,"",No
The Black Cat,Edgar Allan Poe,"",9780930350871,paperback,read,2024/02/03,"","",1,"",,,,,,,5.0,This is currently my favorite the of Edgar Allen Poe’s short stories I have read thus far.,"",,"",No
My Brilliant Friend,Elena Ferrante,Ann Goldstein (Translator),9781609458638,digital,currently-reading,2026/01/07,"","",0,"",,,,,,,,,"",,"",No
All the Light We Cannot See,Anthony Doerr,"",9781476746586,hardcover,to-read,2024/10/11,"","",0,"",,,,,,,,,"",,"",No
The Taming of the Shrew,William Shakespeare,"",9780743477574,paperback,read,2025/05/24,2025/05/24,2025/05/24,1,"",,,,,,,5.0,"Problematic as it may be, I loved it.<br><br>As a Washington/Seattle girl, one of my comfort movies is <i>10 Things I Hate About You</i>. Until recently, I hadn’t realized that Shakespeare’s <i>The Taming of the Shrew</i> was the source material for the film. The play is also where the expressions <i>“kill with kindness”</i> and <i>“break the ice”</i> come from.<br><br><i>The Taming of the Shrew</i> is often criticized for its mistreatment of Kate — interpreted by modern audiences as a parable about breaking a woman’s spirit. You can’t throw a stone without hitting someone who will lament on just how misogynistic this play is, so instead I’ll present an alternative interpretation: Kate meets her match in Petruchio, and vice versa. They are both total nutcases and they match each other’s freak.<br><br>If you’ve got an hour, <a href=""https://youtu.be/gH9FsjtBLSI?si=TFs_rDYNkmdvCdxF""> this early performance </a> from a young Meryl Streep at the very start of her career is worth a watch. And here’s the accompanying <a href=""https://www.nytimes.com/1978/08/06/archives/shakespeares-shrew-with-no-apologies-shakespeares-shrew-with-no.html""> 1978 <i>New York Times</i> article</a>.","",,"",No
Notes from Underground,Fyodor Dostoevsky,"Larissa Volokhonsky (Translator), Richard Pevear (Translator)",9781400041916,hardcover,read,2025/11/11,2025/12/29,2025/12/29,1,"",,,,,,,3.0,"I had a really hard time with this. It is definitely not the type of book to be read in short increments before bed (which is how I read it). I'll definitely have to try again! I loved Dostoevsky's <i>Crime and Punishment</i> — it ranks among my all-time favorites, but I think this was much less approachable and more difficult even though it was shorter.","",,"",No
A Court of Mist and Fury,Sarah J. Maas,"",9781635575583,paperback,read,2023/09/01,"","",1,"",,,,,,,,,"",,"",No
The Snow Child,Eowyn Ivey,"",9780316175678,hardcover,to-read,2025/02/20,"","",0,"",,,,,,,,,"",,"",No
Beartown,Fredrik Backman,Marin Ireland,9781508231530,audio,to-read,2025/11/08,"","",0,"",,,,,,,,,"",,"",No
The Power Broker: Robert Moses and the Fall of New York,Robert A. Caro,"",9780394720241,paperback,to-read,2024/03/03,"","",0,"",,,,,,,,,"",,"",No
"The Longevity Economy: Unlocking the World's Fastest-Growing, Most Misunderstood Market",Joseph F. Coughlin,"",9781610396639,hardcover,read,2025/08/04,2025/08/07,2025/08/07,1,"",,,,,,,3.0,I read this so I’d have stuff to talk about on LinkedIn… for that it was great! Honestly it was pretty great in general. Age tech is a super interesting space in the way that businesses often approach building for older adults.,"",,"",No
"The Bomber Mafia: A Dream, a Temptation, and the Longest Night of the Second World War",Malcolm Gladwell,"",9780316296618,hardcover,to-read,2022/08/14,"","",0,"",,,,,,,,,"",,"",No
A Court of Thorns and Roses,Sarah J. Maas,"",9781635575569,paperback,read,2023/09/01,"","",1,"",,,,,,,,,"",,"",No
Alchemised,SenLinYu,"",9780593972700,hardcover,to-read,2025/09/28,"","",0,"",,,,,,,,,"",,"",No
Middlemarch,George Eliot,"Rosemary Ashton (Contributor), Coralie Bickford-Smith (Illustrator)",9780141196893,hardcover,read,2023/08/17,2024/03/28,2024/03/28,1,"",,,,,,,5.0,"This is my new favorite book. It’s long &amp; slow-going, but it’s also nearly perfect.","",,favorites,No
Tess of the d'Urbervilles,Thomas Hardy,"Margaret R. Higonnet (Contributor), Tim Dolin (Contributor)",9780141040332,hardcover,to-read,2023/10/23,"","",0,"",,,,,,,,,"",,"",No
The Assassin's Blade,Sarah J. Maas,"",9781619632219,digital,read,2023/09/01,"","",1,"",,,,,,,,,"",,"",No
And Now I Spill the Family Secrets: An Illustrated Memoir,Margaret Kimball,"",9780063007444,paperback,to-read,2022/08/14,"","",0,"",,,,,,,,,"",,"",No
The Hobbit,J.R.R. Tolkien,"",9780261103283,hardcover,read,2023/09/02,2023/09/18,2023/09/18,1,"",,,,,,,3.0,This is a perfect read aloud / fireside book for kids. Did I need to read it as an adult? Probably not. The writing style made this pretty boring at times.,"",,"",No
Demon Copperhead,Barbara Kingsolver,Charlie Thurston (Narrator),9780571376506,audio,to-read,2024/10/11,"","",0,"",,,,,,,,,"",,"",No
The Buccaneers,"Angela Mackworth-Young, Edith Wharton","",9780140241648,paperback,read,2023/11/11,2023/11/14,2023/11/14,1,"",,,,,,,3.0,I was lured into reading this book after watching the first few episodes of the 2023 Apple TV adaptation.,"",,"",No
Onyx Storm,Rebecca Yarros,"",9781649374189,hardcover,read,2025/01/23,2025/01/25,2025/01/25,1,"",,,,,,,2.0,The writing felt super rushed! I also found it very challenging to track the myriad of characters. I'll read the next one though. Glad author is taking a longer break between books.,"",,"",No
Of Ghosts and Goblins,Lafcadio Hearn,"",9780241573723,hardcover,to-read,2024/01/18,"","",0,"",,,,,,,,,"",,"",No
Jane Eyre,Charlotte Brontë,"",9780141040387,hardcover,read,2022/08/07,2023/03/31,2023/03/31,1,"",,,,,,,5.0,"This is definitely an all time favorite. I also think it’s WAY better as a reread when you know that it picks up after the first 120 pages. It almost (but not quite) makes those first 120 pages enjoyable.<br><br>~~~~~~~~~~~~~~~~~~~~~~<br><br>March 2023: <br><br>I wanted to read more classics this year, and I fear that by starting with Jane Eyre, my goal will go unrealized. It is hard to imagine a story that will top this one. Brontë beautifully depicts the strength of the human spirit and the importance of being true to yourself &amp; your beliefs.","",,favorites,No
Under a White Sky,Elizabeth Kolbert,"",9780593136270,hardcover,to-read,2022/08/14,"","",0,"",,,,,,,,,"",,"",No
Little Women,Louisa May Alcott,Anna Bond (Illustrator),9780147514011,hardcover,read,2023/09/24,2023/09/28,2023/09/28,1,"",,,,,,,5.0,I can’t believe I missed out on reading this book in my childhood. Loved it.,"",,"",No
"Idol, Burning",Rin Usami,Asa Yoneda (Translator),9780063213289,hardcover,to-read,2024/03/14,"","",0,"",,,,,,,,,"",,"",No
Tom Lake,Ann Patchett,"",9780063327528,hardcover,read,2025/01/08,2025/01/16,2025/01/16,1,"",,,,,,,5.0,"The pandemic was a time of contrasts. For some, it meant grueling demands on essential workers and healthcare providers; for others, the privilege of working from home and newfound flexibility. It revealed, with painful clarity, the disparities of life in America, as George Floyd’s murder ignited nationwide Black Lives Matter protests. It brought innovation and global cooperation—like the race to develop a vaccine—while also exposing deep divisions and systemic inequities. And for many, it was a period of stillness, of both fear and reflection.<br><br>Contrast is at the heart of Ann Patchett’s <i>Tom Lake</i>, where the pandemic serves as a subtle but resonant backdrop. It’s impossible to ignore the heartbreak of that time—I remember spending hours each morning glued to my phone, following news about lockdown mandates, death tolls in Italy, the latest protests, and vaccine developments. But the pandemic also had a way of slowing life down, encouraging me to notice the quiet joys of the everyday. Patchett captures this duality so well. Beneath the uncertainty and fear of <i>Tom Lake</i> lies a celebration of the present moment, a reminder to hold close what truly matters.<br><br>At the center of the novel is Lara Kenison, a cherry farmer, mother, and former actress, who spends her pandemic summer with her three grown daughters, Emily, Maisie, and Nell. The girls, forced to return home due to the pandemic, become the new cherry-picking crew on their Michigan farm. To pass the time, Lara shares the story of a pivotal summer in her twenties when she acted in summer stock theater, fell in love with Peter Duke—an aspiring actor who would later become a famous movie star—and made choices that would forever shape her life.<br><br>The novel is steeped in nostalgia, both for Lara’s youth and for the simpler, slower rhythm of life on the cherry farm. I found myself reflecting on my own pandemic experience as Lara’s daughters navigated their summer in a safe, comforting bubble. Like them, I spent those months with family, balancing global anxiety with the grounding simplicity of home. I remember the slow, unhurried days at my parents’ house—drinking black coffee on the front porch, inching my chair back to stay in the shade a little longer. I watched college lectures on Zoom while lying in the grass, picked blueberries from the backyard, and discovered the joy of listening to entire albums instead of playlists.<br><br>Even the subtext of Lara’s story is rich with this theme of contrast. She was a good actress with good connections and the reader cannot help but to image the life she could have had—one filled with fame, money, and glamour—had she stayed in California and pursued acting. Instead, she chose a quieter, more grounded existence as a mother, wife, and farmer. As she shares her memories, Lara insists she has no regrets about the life she built, but I can’t help wondering, just a little, if she let's herself wonder about the paths not taken. It’s a tension that’s deeply human: imagining the ""what-ifs"" while still cherishing the beauty of the life you’ve chosen.<br><br>Listening to the audiobook, narrated by Meryl Streep, was an experience all its own. Streep’s warm, intimate performance made me feel as though Lara was speaking directly to me, and her voice brought the story to life with such depth and nuance. I mostly listened while running, imagining myself under the sun-drenched summer of a Michigan cherry orchard. In reality, I was trudging through the foggy Snohomish winter, but even here, there's plenty to appreciate —deer grazing on frosted grass, evergreen trees standing tall, and, on clear days, the snow-capped mountains in the distance.<br><br>Patchett’s prose is poetic without ever feeling forced. <i>Tom Lake</i> is a slower burn of a novel, one that invites you to reflect on the people you love, to find beauty in the fleeting moments, and to appreciate the simple life—a life rooted in connection, in place, in purpose. Like a cherry orchard in bloom, its joys are all the more precious for their impermanence.","",,"",No
Agnes Grey,Anne Brontë,"",9781509890002,hardcover,read,2024/10/10,2024/10/19,2024/10/19,1,"",,,,,,,2.0,"Not for me, but I won’t give up on Anne completely. I think this book is safe to skip as far as Brontë classics g, but I’ll try “The Tenant of Wildfell Hall” someday.","",,"",No
Bunny,Mona Awad,"",9780525559757,paperback,read,2026/01/03,2026/01/03,2026/01/03,1,"",,,,,,,3.0,,"",,"",No
Just Kids,Patti Smith,Alessandro Mari (Translator),9788807885778,paperback,to-read,2023/09/28,"","",0,"",,,,,,,,,"",,"",No
Charlotte's Web,E.B. White,Garth Williams (Illustrator),9780064410939,paperback,read,2023/09/02,2025/01/28,2025/01/28,1,"",,,,,,,3.0,"<blockquote>""These autumn days will shorten and grow cold. The leaves will shake loose from the trees and fall. Christmas will come, then the snows of winter. You will live to enjoy the beauty of the frozen world, for you mean a great deal to Zuckerman and he will not harm you, ever. Winter will pass, the days will lengthen, the ice will melt in the pasture pond. The song sparrow will return and sing, the frogs will awake, the warm wind will blow again. All these sights and sounds and smells will be yours to enjoy, Wilbur — this lovely world, these precious days …""</blockquote><br>I have to admit that I've never really understood the magic of Charlotte's Web. It was not a beloved book to me as a child and is still not as an adult.<br><br>Reading it this time around, I was surprised by just how Christian a story it is. Although nobody goes as far as mentioning ""God"" when the Zuckermans awake to see the words woven into the web, they use terms like ""miracle"" and ""wonder."" They consult their minister, who delivers a sermon.<br><br>But really it is Charlotte who embodies a sort of saintliness: spending her little time on this earth in service of Wilbur. Charlotte, who never sought glory and never begrudged Wilbur the honor that her incredible webs brought him. That White writes Charlotte to credit the act of procreation as her finest work, above her miraculous webs, reveals quite a religious sensibility.","",,"",No
Crying in H Mart,Michelle Zauner,"",9780525657743,hardcover,to-read,2022/08/14,"","",0,"",,,,,,,,,"",,"",No
The Final Revival of Opal & Nev,Dawnie Walton,"",9781982140168,hardcover,to-read,2022/08/14,"","",0,"",,,,,,,,,"",,"",No
The Masque of the Red Death,Edgar Allan Poe,"",9780241573754,hardcover,read,2024/01/18,2024/02/26,2024/02/26,1,"",,,,,,,3.0,I don’t know if Edgar Allen Poe is not for me or I was just not in the right mood to read these short stories. My favorites were The Black Cat and The Tell-Tale Heart.,"",,"",No
The Wizard of Oz,L. Frank Baum,Lisbeth Zwerger,9781558586383,hardcover,to-read,2023/09/02,"","",0,"",,,,,,,,,"",,"",No
Ender's Game,Orson Scott Card,"",9780812550702,paperback,to-read,2022/08/07,"","",0,"",,,,,,,,,"",,"",No
Black Beauty,Anna Sewell,"",9780099572930,paperback,to-read,2023/09/02,"","",0,"",,,,,,,,,"",,"",No
The Comedy of Errors,William Shakespeare,"",9780812969337,paperback,read,2025/05/22,2025/05/22,2025/05/22,1,"",,,,,,,3.0,"<i>The Comedy of Errors</i> is one of Shakespeare’s earliest works. It’s a quick read and leans heavily into its own chaos. <br><br>Shakespeare takes the basic plot from Plautus’s Menaechmi, then cranks it up a notch: two sets of identical twins separated at birth. One pair are both named Antipholus, and the other pair fills a servant for each. Both identical servants are named Dromio. They come together in Ephesus, but don't meet their twin counterparts until the end of play. The result? A ridiculous mess of mistaken identities, farce, and some truly baffling encounters.<br><br>The humor hinges on us accepting that these characters are so committed to their illogical reasoning that, for example, Egeon and his wife, parents of twins so identical they can only be told apart by name, would name them the same thing.<br><br>Or that Antipholus of Syracuse spends seven years desperately searching for his long-lost twin brother, whom without, he describes himself:<br><blockquote><br>“I to the world am like a drop of water That in the ocean seeks another drop, Who, falling there to find his fellow forth, Unseen, inquisitive, confounds himself. So I, to find a mother and a brother, In quest of them, unhappy, lose myself.” —Antipholus of Syracuse, Act 1, Scene 2<br></blockquote><br>When complete strangers start greeting him like they know him, demanding money, or calling him “husband,” he never once thinks, “Hmm, could this be my twin brother?” No— obviously this strange treatment is the result of witchcraft. <br><br><i>The Comedy of Errors</i> is a play that revels in its absurdity, which is exactly why it works.","",,"",No
Wide Sargasso Sea,Jean Rhys,"",9780241281901,hardcover,read,2023/04/02,2023/10/11,2023/10/11,1,"",,,,,,,2.0,"I really wanted to enjoy this, but had a really hard time following the story. It reminded me a lot of a Samantha Schweblin’s “Fever Dream” but it was not as well executed. I don’t feel like I wasted my time reading it (It’s the perfect size for a plane-read), but I don’t think it’s one I’ll revisit.","",,"",No
The Canterbury Tales,Geoffrey Chaucer,Nevill Coghill (Translator),9780141393216,hardcover,to-read,2024/01/04,"","",0,"",,,,,,,,,"",,"",No
Dear Data,"Giorgia Lupi, Stefanie Posavec",Maria Popova (Contributor),9781616895327,paperback,read,2023/09/19,"","",1,"",,,,,,,,,"",,coffee-table,No
Grace Hopper and the Invention of the Information Age,Kurt W. Beyer,"",9780262517263,paperback,read,2023/01/04,2023/03/20,2023/03/20,1,"",,,,,,,3.0,"This book is much more an overview of how the Information Age came to be (or at least the contributions of American innovators to the early field) than it is a biography centered on Grace Hopper. While a little dry, it’s an informative and well researched read for anyone interested in the history of early computing.","",,"",No
A Man Called Ove,Fredrik Backman,Henning Koch (Translator),9781476738017,hardcover,read,2025/01/20,2025/02/01,2025/02/01,1,"",,,,,,,4.0,"<i>“To love someone is like moving into a house,"" Sonja used to say. ""At first you fall in love in everything new, you wonder every morning that this is one's own, as if they are afraid that someone will suddenly come tumbling through the door and say that there has been a serious mistake and that it simply was not meant to would live so fine. But as the years go by, the facade worn, the wood cracks here and there, and you start to love this house not so much for all the ways it is perfect in that for all the ways it is not. You become familiar with all its nooks and crannies. How to avoid that the key gets stuck in the lock if it is cold outside. Which floorboards have some give when you step on them, and exactly how to open the doors for them not to creak. That's it, all the little secrets that make it your home.”</i><br><br>I stumbled upon this quote and immediately fell in love, when I discovered it was from <i>A Man Called Ove</i>, I immediately checked it out from the library and without knowing anything about plot, dove right in. I was a bit surprised to discover that while the quote hints at a romance, this is not really a love story.<br><br>It's dark but also wholesome. Funny, yet tragic. It was 100% worth my time.","",,"",No
